{
  "id": "mission.intro",
  "name": "Intro Mission",
  "kind": "intro",
  "status": "ready",
  "order": 0,
  "briefing": "Scorched Oasis: a pool of cool water ringed by scrub and scattered woods, with dry hardpan all around. Eris Lance comes in from the south edge and Solitaire Lance from the north, and both want the shade and the high ground. Cut the water or the trees between you and the guns you cannot afford to face. Put every working enemy 'Mech down, or leave them too crippled to fight, and the oasis is yours.",
  "map": "map.scorched-oasis",
  "sides": [
    {
      "id": "a",
      "label": "Eris Lance",
      "force": "force.intro-a",
      "control": "either",
      "homeEdge": "south",
      "deployment": { "mode": "edgeEntry" }
    },
    {
      "id": "b",
      "label": "Solitaire Lance",
      "force": "force.intro-b",
      "control": "either",
      "homeEdge": "north",
      "deployment": { "mode": "edgeEntry" }
    }
  ],
  "defaultHumanSide": "a",
  "victory": [
    { "type": "eliminate", "cripple": true }
  ],
  "options": { "forcedWithdrawal": "off", "halfLoads": false, "pilotCards": false },
  "source": { "ref": "ours", "note": "shape per 11-missions section 6; booklet not read" },
  "verify": [
    {
      "path": "/map",
      "note": "Scorched Oasis (Desert #2) layout from a MegaMek cross-check; Core Box name-to-sheet mapping and photo check pending",
      "status": "unconfirmed"
    },
    {
      "path": "/sides",
      "note": "forces use stock stand-ins for two box variants; base BV a 2752 vs b 3079 (b heavier), not rebalanced",
      "status": "standIn"
    }
  ]
}
